{
  "gene_id": "mmu:pdyn",
  "dataset_id": "hughes-2009",
  "symbol": "Pdyn",
  "algorithms": {
    "jtk_cycle": {
      "available": true,
      "phase": 15.0,
      "amplitude": 0.989949493661181,
      "period": 24.0,
      "power": null,
      "p_value": 0.111939046572356,
      "q_value": 0.200706167586063,
      "rhythmic": false
    },
    "ejtk": {
      "available": false,
      "phase": null,
      "amplitude": null,
      "period": null,
      "power": null,
      "p_value": null,
      "q_value": null,
      "rhythmic": null
    },
    "lomb_scargle": {
      "available": false,
      "phase": null,
      "amplitude": null,
      "period": null,
      "power": null,
      "p_value": null,
      "q_value": null,
      "rhythmic": null
    },
    "arser": {
      "available": false,
      "phase": null,
      "amplitude": null,
      "period": null,
      "power": null,
      "p_value": null,
      "q_value": null,
      "rhythmic": null
    },
    "rain": {
      "available": false,
      "phase": null,
      "amplitude": null,
      "period": null,
      "power": null,
      "p_value": null,
      "q_value": null,
      "rhythmic": null
    },
    "metacycle": {
      "available": false,
      "phase": null,
      "amplitude": null,
      "period": null,
      "power": null,
      "p_value": null,
      "q_value": null,
      "rhythmic": null
    }
  },
  "timepoints": [
    18.0,
    19.0,
    20.0,
    21.0,
    22.0,
    23.0,
    24.0,
    25.0,
    26.0,
    27.0,
    28.0,
    29.0,
    30.0,
    31.0,
    32.0,
    33.0,
    34.0,
    35.0,
    36.0,
    37.0,
    38.0,
    39.0,
    40.0,
    41.0,
    42.0,
    43.0,
    44.0,
    45.0,
    46.0,
    47.0,
    48.0,
    49.0,
    50.0,
    51.0,
    52.0,
    53.0,
    54.0,
    55.0,
    56.0,
    57.0,
    58.0,
    59.0,
    60.0,
    61.0,
    62.0,
    63.0,
    64.0,
    65.0
  ],
  "expression_values": [
    82.7,
    85.8,
    79.9,
    86.2,
    84.2,
    86.0,
    82.6,
    85.3,
    81.6,
    84.8,
    85.5,
    85.5,
    86.3,
    85.3,
    85.1,
    86.3,
    86.5,
    84.5,
    83.5,
    84.1,
    85.4,
    87.1,
    87.3,
    88.6,
    86.7,
    87.0,
    89.4,
    86.9,
    93.0,
    88.6,
    92.7,
    87.2,
    83.6,
    86.7,
    86.0,
    85.7,
    84.2,
    86.7,
    85.8,
    87.7,
    87.3,
    87.1,
    89.8,
    99.8,
    91.0,
    91.8,
    96.8,
    98.9
  ],
  "fit_timepoints": [
    18.0,
    18.25,
    18.5,
    18.75,
    19.0,
    19.25,
    19.5,
    19.75,
    20.0,
    20.25,
    20.5,
    20.75,
    21.0,
    21.25,
    21.5,
    21.75,
    22.0,
    22.25,
    22.5,
    22.75,
    23.0,
    23.25,
    23.5,
    23.75,
    24.0,
    24.25,
    24.5,
    24.75,
    25.0,
    25.25,
    25.5,
    25.75,
    26.0,
    26.25,
    26.5,
    26.75,
    27.0,
    27.25,
    27.5,
    27.75,
    28.0,
    28.25,
    28.5,
    28.75,
    29.0,
    29.25,
    29.5,
    29.75,
    30.0,
    30.25,
    30.5,
    30.75,
    31.0,
    31.25,
    31.5,
    31.75,
    32.0,
    32.25,
    32.5,
    32.75,
    33.0,
    33.25,
    33.5,
    33.75,
    34.0,
    34.25,
    34.5,
    34.75,
    35.0,
    35.25,
    35.5,
    35.75,
    36.0,
    36.25,
    36.5,
    36.75,
    37.0,
    37.25,
    37.5,
    37.75,
    38.0,
    38.25,
    38.5,
    38.75,
    39.0,
    39.25,
    39.5,
    39.75,
    40.0,
    40.25,
    40.5,
    40.75,
    41.0,
    41.25,
    41.5,
    41.75,
    42.0,
    42.25,
    42.5,
    42.75,
    43.0,
    43.25,
    43.5,
    43.75,
    44.0,
    44.25,
    44.5,
    44.75,
    45.0,
    45.25,
    45.5,
    45.75,
    46.0,
    46.25,
    46.5,
    46.75,
    47.0,
    47.25,
    47.5,
    47.75,
    48.0,
    48.25,
    48.5,
    48.75,
    49.0,
    49.25,
    49.5,
    49.75,
    50.0,
    50.25,
    50.5,
    50.75,
    51.0,
    51.25,
    51.5,
    51.75,
    52.0,
    52.25,
    52.5,
    52.75,
    53.0,
    53.25,
    53.5,
    53.75,
    54.0,
    54.25,
    54.5,
    54.75,
    55.0,
    55.25,
    55.5,
    55.75,
    56.0,
    56.25,
    56.5,
    56.75,
    57.0,
    57.25,
    57.5,
    57.75,
    58.0,
    58.25,
    58.5,
    58.75,
    59.0,
    59.25,
    59.5,
    59.75,
    60.0,
    60.25,
    60.5,
    60.75,
    61.0,
    61.25,
    61.5,
    61.75,
    62.0,
    62.25,
    62.5,
    62.75,
    63.0,
    63.25,
    63.5,
    63.75,
    64.0,
    64.25,
    64.5,
    64.75,
    65.0
  ],
  "fit_values": [
    88.784033,
    88.699071,
    88.607234,
    88.508916,
    88.404538,
    88.294547,
    88.179414,
    88.059632,
    87.935715,
    87.808191,
    87.677609,
    87.544526,
    87.409513,
    87.273147,
    87.136014,
    86.9987,
    86.861792,
    86.725878,
    86.591539,
    86.459351,
    86.329879,
    86.203678,
    86.081289,
    85.963235,
    85.850023,
    85.742136,
    85.640037,
    85.544163,
    85.454924,
    85.372703,
    85.297852,
    85.230692,
    85.171509,
    85.120557,
    85.078055,
    85.044185,
    85.019091,
    85.002881,
    84.995625,
    84.997353,
    85.008058,
    85.027694,
    85.056178,
    85.093387,
    85.139161,
    85.193306,
    85.255588,
    85.325742,
    85.403467,
    85.488429,
    85.580266,
    85.678584,
    85.782962,
    85.892953,
    86.008086,
    86.127868,
    86.251785,
    86.379309,
    86.509891,
    86.642974,
    86.777987,
    86.914353,
    87.051486,
    87.1888,
    87.325708,
    87.461622,
    87.595961,
    87.728149,
    87.857621,
    87.983822,
    88.106211,
    88.224265,
    88.337477,
    88.445364,
    88.547463,
    88.643337,
    88.732576,
    88.814797,
    88.889648,
    88.956808,
    89.015991,
    89.066943,
    89.109445,
    89.143315,
    89.168409,
    89.184619,
    89.191875,
    89.190147,
    89.179442,
    89.159806,
    89.131322,
    89.094113,
    89.048339,
    88.994194,
    88.931912,
    88.861758,
    88.784033,
    88.699071,
    88.607234,
    88.508916,
    88.404538,
    88.294547,
    88.179414,
    88.059632,
    87.935715,
    87.808191,
    87.677609,
    87.544526,
    87.409513,
    87.273147,
    87.136014,
    86.9987,
    86.861792,
    86.725878,
    86.591539,
    86.459351,
    86.329879,
    86.203678,
    86.081289,
    85.963235,
    85.850023,
    85.742136,
    85.640037,
    85.544163,
    85.454924,
    85.372703,
    85.297852,
    85.230692,
    85.171509,
    85.120557,
    85.078055,
    85.044185,
    85.019091,
    85.002881,
    84.995625,
    84.997353,
    85.008058,
    85.027694,
    85.056178,
    85.093387,
    85.139161,
    85.193306,
    85.255588,
    85.325742,
    85.403467,
    85.488429,
    85.580266,
    85.678584,
    85.782962,
    85.892953,
    86.008086,
    86.127868,
    86.251785,
    86.379309,
    86.509891,
    86.642974,
    86.777987,
    86.914353,
    87.051486,
    87.1888,
    87.325708,
    87.461622,
    87.595961,
    87.728149,
    87.857621,
    87.983822,
    88.106211,
    88.224265,
    88.337477,
    88.445364,
    88.547463,
    88.643337,
    88.732576,
    88.814797,
    88.889648,
    88.956808,
    89.015991,
    89.066943,
    89.109445,
    89.143315,
    89.168409,
    89.184619,
    89.191875,
    89.190147,
    89.179442,
    89.159806,
    89.131322,
    89.094113,
    89.048339
  ],
  "units": "MAS5 expression intensity",
  "metadata": {
    "species": "Mus musculus",
    "tissue": "Liver",
    "platform": "Affymetrix Mouse Genome 430 2.0 Array (GPL1261)",
    "selected_probeset_id": "1416266_at",
    "source_symbol": "Pdyn",
    "available_algorithm_ids": [
      "jtk_cycle"
    ],
    "supported_algorithm_ids": [
      "jtk_cycle",
      "ejtk",
      "lomb_scargle",
      "arser",
      "rain",
      "metacycle"
    ],
    "sample_ids": [
      "GSM301348",
      "GSM301349",
      "GSM301350",
      "GSM301351",
      "GSM301352",
      "GSM301353",
      "GSM301354",
      "GSM301355",
      "GSM301356",
      "GSM301357",
      "GSM301358",
      "GSM301359",
      "GSM301360",
      "GSM301361",
      "GSM301362",
      "GSM301363",
      "GSM301364",
      "GSM301365",
      "GSM301366",
      "GSM301367",
      "GSM301368",
      "GSM301369",
      "GSM301370",
      "GSM301371",
      "GSM301372",
      "GSM301373",
      "GSM301374",
      "GSM301375",
      "GSM301376",
      "GSM301377",
      "GSM301378",
      "GSM301379",
      "GSM301380",
      "GSM301381",
      "GSM301382",
      "GSM301383",
      "GSM301384",
      "GSM301385",
      "GSM301386",
      "GSM301387",
      "GSM301388",
      "GSM301389",
      "GSM301390",
      "GSM301391",
      "GSM301392",
      "GSM301393",
      "GSM301394",
      "GSM301395"
    ],
    "time_axis_label": "Circadian time (CT, hours)",
    "time_axis_kind": "circadian_time",
    "cycle_length_hours": 24.0,
    "fit_method": "24 h cosinor least-squares fit",
    "fit_period_hours": 24.0,
    "fit_baseline": 87.09375,
    "fit_amplitude": 2.098551,
    "fit_phase_hours": 15.576933,
    "source_files": [
      "hughes2009_liver48_jtk_gene_best_probe_ranked.csv",
      "gse11923_expr_probe_x_sample.csv",
      "gse11923_pheno_data.csv"
    ]
  }
}
