{
  "gene_id": "mmu:a830021m18rik",
  "dataset_id": "hughes-2009",
  "symbol": "A830021M18Rik",
  "algorithms": {
    "jtk_cycle": {
      "available": true,
      "phase": 15.0,
      "amplitude": 1.97989898732233,
      "period": 24.0,
      "power": null,
      "p_value": 0.0135627446558277,
      "q_value": 0.0576905919760902,
      "rhythmic": false
    },
    "ejtk": {
      "available": false,
      "phase": null,
      "amplitude": null,
      "period": null,
      "power": null,
      "p_value": null,
      "q_value": null,
      "rhythmic": null
    },
    "lomb_scargle": {
      "available": false,
      "phase": null,
      "amplitude": null,
      "period": null,
      "power": null,
      "p_value": null,
      "q_value": null,
      "rhythmic": null
    },
    "arser": {
      "available": false,
      "phase": null,
      "amplitude": null,
      "period": null,
      "power": null,
      "p_value": null,
      "q_value": null,
      "rhythmic": null
    },
    "rain": {
      "available": false,
      "phase": null,
      "amplitude": null,
      "period": null,
      "power": null,
      "p_value": null,
      "q_value": null,
      "rhythmic": null
    },
    "metacycle": {
      "available": false,
      "phase": null,
      "amplitude": null,
      "period": null,
      "power": null,
      "p_value": null,
      "q_value": null,
      "rhythmic": null
    }
  },
  "timepoints": [
    18.0,
    19.0,
    20.0,
    21.0,
    22.0,
    23.0,
    24.0,
    25.0,
    26.0,
    27.0,
    28.0,
    29.0,
    30.0,
    31.0,
    32.0,
    33.0,
    34.0,
    35.0,
    36.0,
    37.0,
    38.0,
    39.0,
    40.0,
    41.0,
    42.0,
    43.0,
    44.0,
    45.0,
    46.0,
    47.0,
    48.0,
    49.0,
    50.0,
    51.0,
    52.0,
    53.0,
    54.0,
    55.0,
    56.0,
    57.0,
    58.0,
    59.0,
    60.0,
    61.0,
    62.0,
    63.0,
    64.0,
    65.0
  ],
  "expression_values": [
    80.0,
    80.9,
    81.4,
    77.6,
    75.8,
    81.4,
    76.3,
    82.9,
    72.6,
    77.4,
    80.6,
    80.8,
    82.1,
    77.7,
    79.5,
    82.5,
    82.2,
    79.8,
    80.7,
    81.6,
    81.4,
    82.6,
    83.0,
    84.6,
    82.4,
    82.8,
    81.6,
    82.4,
    86.6,
    84.5,
    81.7,
    82.9,
    77.5,
    82.3,
    81.7,
    80.7,
    80.3,
    82.6,
    81.3,
    83.6,
    83.2,
    89.8,
    86.3,
    87.3,
    85.5,
    86.9,
    88.8,
    140.2
  ],
  "fit_method": "lowess",
  "units": "MAS5 expression intensity",
  "metadata": {
    "species": "Mus musculus",
    "tissue": "Liver",
    "platform": "Affymetrix Mouse Genome 430 2.0 Array (GPL1261)",
    "selected_probeset_id": "1445721_at",
    "source_symbol": "A830021M18Rik",
    "available_algorithm_ids": [
      "jtk_cycle"
    ],
    "supported_algorithm_ids": [
      "jtk_cycle",
      "ejtk",
      "lomb_scargle",
      "arser",
      "rain",
      "metacycle"
    ],
    "sample_ids": [
      "GSM301348",
      "GSM301349",
      "GSM301350",
      "GSM301351",
      "GSM301352",
      "GSM301353",
      "GSM301354",
      "GSM301355",
      "GSM301356",
      "GSM301357",
      "GSM301358",
      "GSM301359",
      "GSM301360",
      "GSM301361",
      "GSM301362",
      "GSM301363",
      "GSM301364",
      "GSM301365",
      "GSM301366",
      "GSM301367",
      "GSM301368",
      "GSM301369",
      "GSM301370",
      "GSM301371",
      "GSM301372",
      "GSM301373",
      "GSM301374",
      "GSM301375",
      "GSM301376",
      "GSM301377",
      "GSM301378",
      "GSM301379",
      "GSM301380",
      "GSM301381",
      "GSM301382",
      "GSM301383",
      "GSM301384",
      "GSM301385",
      "GSM301386",
      "GSM301387",
      "GSM301388",
      "GSM301389",
      "GSM301390",
      "GSM301391",
      "GSM301392",
      "GSM301393",
      "GSM301394",
      "GSM301395"
    ],
    "time_axis_label": "Circadian time (CT, hours)",
    "time_axis_kind": "circadian_time",
    "cycle_length_hours": 24.0,
    "fit_display_method": "LOWESS visual smoothing",
    "fit_display_frac": 0.3,
    "fit_display_robust_iterations": 3,
    "source_files": [
      "hughes2009_liver48_jtk_gene_best_probe_ranked.csv",
      "gse11923_expr_probe_x_sample.csv",
      "gse11923_pheno_data.csv"
    ]
  },
  "fit_timepoints": [
    18.0,
    18.2956,
    18.5912,
    18.8868,
    19.1824,
    19.478,
    19.7736,
    20.0692,
    20.3648,
    20.6604,
    20.956,
    21.2516,
    21.5472,
    21.8428,
    22.1384,
    22.434,
    22.7296,
    23.0252,
    23.3208,
    23.6164,
    23.9119,
    24.2075,
    24.5031,
    24.7987,
    25.0943,
    25.3899,
    25.6855,
    25.9811,
    26.2767,
    26.5723,
    26.8679,
    27.1635,
    27.4591,
    27.7547,
    28.0503,
    28.3459,
    28.6415,
    28.9371,
    29.2327,
    29.5283,
    29.8239,
    30.1195,
    30.4151,
    30.7107,
    31.0063,
    31.3019,
    31.5975,
    31.8931,
    32.1887,
    32.4843,
    32.7799,
    33.0755,
    33.3711,
    33.6667,
    33.9623,
    34.2579,
    34.5535,
    34.8491,
    35.1447,
    35.4403,
    35.7358,
    36.0314,
    36.327,
    36.6226,
    36.9182,
    37.2138,
    37.5094,
    37.805,
    38.1006,
    38.3962,
    38.6918,
    38.9874,
    39.283,
    39.5786,
    39.8742,
    40.1698,
    40.4654,
    40.761,
    41.0566,
    41.3522,
    41.6478,
    41.9434,
    42.239,
    42.5346,
    42.8302,
    43.1258,
    43.4214,
    43.717,
    44.0126,
    44.3082,
    44.6038,
    44.8994,
    45.195,
    45.4906,
    45.7862,
    46.0818,
    46.3774,
    46.673,
    46.9686,
    47.2642,
    47.5597,
    47.8553,
    48.1509,
    48.4465,
    48.7421,
    49.0377,
    49.3333,
    49.6289,
    49.9245,
    50.2201,
    50.5157,
    50.8113,
    51.1069,
    51.4025,
    51.6981,
    51.9937,
    52.2893,
    52.5849,
    52.8805,
    53.1761,
    53.4717,
    53.7673,
    54.0629,
    54.3585,
    54.6541,
    54.9497,
    55.2453,
    55.5409,
    55.8365,
    56.1321,
    56.4277,
    56.7233,
    57.0189,
    57.3145,
    57.6101,
    57.9057,
    58.2013,
    58.4969,
    58.7925,
    59.0881,
    59.3836,
    59.6792,
    59.9748,
    60.2704,
    60.566,
    60.8616,
    61.1572,
    61.4528,
    61.7484,
    62.044,
    62.3396,
    62.6352,
    62.9308,
    63.2264,
    63.522,
    63.8176,
    64.1132,
    64.4088,
    64.7044,
    65.0
  ],
  "fit_values": [
    80.095419,
    80.039763,
    79.984107,
    79.928451,
    79.877708,
    79.830014,
    79.78232,
    79.736447,
    79.696532,
    79.656616,
    79.616701,
    79.580652,
    79.54528,
    79.509908,
    79.474685,
    79.439631,
    79.404576,
    79.369055,
    79.32852,
    79.287985,
    79.247464,
    79.253137,
    79.27843,
    79.303722,
    79.335356,
    79.380528,
    79.425699,
    79.470871,
    79.531501,
    79.593187,
    79.654873,
    79.713379,
    79.769314,
    79.82525,
    79.88061,
    79.933169,
    79.985727,
    80.038286,
    80.100192,
    80.164626,
    80.229059,
    80.290472,
    80.347433,
    80.404394,
    80.461207,
    80.511278,
    80.561349,
    80.611419,
    80.655547,
    80.696308,
    80.737068,
    80.7777,
    80.817953,
    80.858207,
    80.89846,
    80.958409,
    81.021237,
    81.084064,
    81.160442,
    81.250949,
    81.341426,
    81.432402,
    81.527318,
    81.622234,
    81.71715,
    81.796045,
    81.86881,
    81.941575,
    82.007736,
    82.061095,
    82.114455,
    82.167814,
    82.222857,
    82.277974,
    82.333092,
    82.395703,
    82.463865,
    82.532027,
    82.600289,
    82.668967,
    82.737645,
    82.806324,
    82.857104,
    82.903646,
    82.950188,
    82.982721,
    82.996346,
    83.00997,
    83.021994,
    82.998046,
    82.974098,
    82.95015,
    82.913259,
    82.869692,
    82.826126,
    82.782673,
    82.739521,
    82.696369,
    82.653216,
    82.61223,
    82.571515,
    82.530786,
    82.484771,
    82.433689,
    82.382607,
    82.32981,
    82.265289,
    82.200768,
    82.136246,
    82.064079,
    81.989289,
    81.914499,
    81.848671,
    81.798665,
    81.748659,
    81.698653,
    81.697342,
    81.697092,
    81.696841,
    81.73141,
    81.789607,
    81.847804,
    81.920164,
    82.044922,
    82.169681,
    82.294439,
    82.46334,
    82.641292,
    82.819244,
    83.000704,
    83.186506,
    83.372308,
    83.558481,
    83.750075,
    83.941669,
    84.133263,
    84.334759,
    84.540893,
    84.747028,
    84.953233,
    85.159537,
    85.36591,
    85.572283,
    85.782936,
    85.993989,
    86.205042,
    86.414692,
    86.623107,
    86.831521,
    87.039052,
    87.24153,
    87.444007,
    87.646485,
    87.844751,
    88.041731,
    88.23871,
    88.434351,
    88.627835,
    88.821319,
    89.014804
  ]
}
